{
  "id": "evt_1000_1",
  "type": "zone_exit",
  "status": "confirmed",
  "ts_start_ms": 1000,
  "ts_end_ms": 1000,
  "detected_at_ms": 1000,
  "source_id": "living_room",
  "actants": [
    { "type": "person", "label": "person_1" }
  ],
  "evidence": [
    {
      "kind": "zone_boundary_crossing",
      "source": "fast_path",
      "observed_at_ms": 1000,
      "detail": "一人可見地穿越已設定的畫面區域邊界"
    }
  ],
  "risk": { "level": "none", "category": "none", "reason": null },
  "confidence": 0.9,
  "detector": "zone_exit_v1",
  "latency_ms": 0
}
